{
  "schema_version": "1.0",
  "generated_at": "2026-08-12T11:27:12Z",
  "mock": false,
  "rules_version": "1.0",
  "items": [
    {
      "recommendation_id": "REC-0A3BF0B011C5",
      "dimension_type": "category",
      "target": "cat41",
      "severity": "CRITICAL",
      "title": "Reduzir violações de KPI",
      "recommendation": "Analisar os incidentes violados, identificar causas comuns e definir um plano de correção.",
      "evidence": "Taxa calculada de violação de 95.29% em 531 incidentes avaliados.",
      "metric_name": "kpi_violation_rate_pct",
      "metric_value": 95.29,
      "metric_unit": "percent"
    },
    {
      "recommendation_id": "REC-404FF971F609",
      "dimension_type": "product",
      "target": "lcsi",
      "severity": "CRITICAL",
      "title": "Reduzir violações de KPI",
      "recommendation": "Analisar os incidentes violados, identificar causas comuns e definir um plano de correção.",
      "evidence": "Taxa calculada de violação de 55.92% em 1064 incidentes avaliados.",
      "metric_name": "kpi_violation_rate_pct",
      "metric_value": 55.92,
      "metric_unit": "percent"
    },
    {
      "recommendation_id": "REC-421F945DF2E3",
      "dimension_type": "category",
      "target": "cat59",
      "severity": "CRITICAL",
      "title": "Reduzir violações de KPI",
      "recommendation": "Analisar os incidentes violados, identificar causas comuns e definir um plano de correção.",
      "evidence": "Taxa calculada de violação de 100.00% em 10 incidentes avaliados.",
      "metric_name": "kpi_violation_rate_pct",
      "metric_value": 100.0,
      "metric_unit": "percent"
    },
    {
      "recommendation_id": "REC-7D977EFB45E9",
      "dimension_type": "annual_priority",
      "target": "2023 | Média",
      "severity": "CRITICAL",
      "title": "Recuperar compliance anual de OLA",
      "recommendation": "Priorizar análise das violações e acompanhar um plano de recuperação para a prioridade.",
      "evidence": "Compliance calculado de 0.00% no ano.",
      "metric_name": "calculated_compliance_pct",
      "metric_value": 0.0,
      "metric_unit": "percent"
    },
    {
      "recommendation_id": "REC-843F4876AB05",
      "dimension_type": "assigned_group",
      "target": "Team06",
      "severity": "CRITICAL",
      "title": "Reduzir violações de KPI",
      "recommendation": "Analisar os incidentes violados, identificar causas comuns e definir um plano de correção.",
      "evidence": "Taxa calculada de violação de 87.50% em 40 incidentes avaliados.",
      "metric_name": "kpi_violation_rate_pct",
      "metric_value": 87.5,
      "metric_unit": "percent"
    },
    {
      "recommendation_id": "REC-94AB101A7CA6",
      "dimension_type": "product",
      "target": "lemg",
      "severity": "CRITICAL",
      "title": "Reduzir violações de KPI",
      "recommendation": "Analisar os incidentes violados, identificar causas comuns e definir um plano de correção.",
      "evidence": "Taxa calculada de violação de 54.00% em 437 incidentes avaliados.",
      "metric_name": "kpi_violation_rate_pct",
      "metric_value": 54.0,
      "metric_unit": "percent"
    },
    {
      "recommendation_id": "REC-A8F79754FAD5",
      "dimension_type": "product",
      "target": "lemn",
      "severity": "CRITICAL",
      "title": "Reduzir violações de KPI",
      "recommendation": "Analisar os incidentes violados, identificar causas comuns e definir um plano de correção.",
      "evidence": "Taxa calculada de violação de 54.30% em 256 incidentes avaliados.",
      "metric_name": "kpi_violation_rate_pct",
      "metric_value": 54.3,
      "metric_unit": "percent"
    },
    {
      "recommendation_id": "REC-D4F2FB06DBFC",
      "dimension_type": "annual_priority",
      "target": "2024 | Média",
      "severity": "CRITICAL",
      "title": "Recuperar compliance anual de OLA",
      "recommendation": "Priorizar análise das violações e acompanhar um plano de recuperação para a prioridade.",
      "evidence": "Compliance calculado de 15.69% no ano.",
      "metric_name": "calculated_compliance_pct",
      "metric_value": 15.69,
      "metric_unit": "percent"
    },
    {
      "recommendation_id": "REC-D5763539245B",
      "dimension_type": "category",
      "target": "cat38",
      "severity": "CRITICAL",
      "title": "Reduzir violações de KPI",
      "recommendation": "Analisar os incidentes violados, identificar causas comuns e definir um plano de correção.",
      "evidence": "Taxa calculada de violação de 75.79% em 95 incidentes avaliados.",
      "metric_name": "kpi_violation_rate_pct",
      "metric_value": 75.79,
      "metric_unit": "percent"
    },
    {
      "recommendation_id": "REC-79F10EA48F58",
      "dimension_type": "assigned_group",
      "target": "Team06",
      "severity": "HIGH",
      "title": "Investigar dimensão com risco elevado",
      "recommendation": "Revisar causas recorrentes, capacidade operacional e ações preventivas para reduzir o risco.",
      "evidence": "Posição 1 no ranking de assigned_group, com score de risco 55.02.",
      "metric_name": "risk_score",
      "metric_value": 55.02,
      "metric_unit": "score"
    },
    {
      "recommendation_id": "REC-AAAA80F76642",
      "dimension_type": "annual_priority",
      "target": "2025 | Média",
      "severity": "HIGH",
      "title": "Recuperar compliance anual de OLA",
      "recommendation": "Priorizar análise das violações e acompanhar um plano de recuperação para a prioridade.",
      "evidence": "Compliance calculado de 83.91% no ano.",
      "metric_name": "calculated_compliance_pct",
      "metric_value": 83.91,
      "metric_unit": "percent"
    },
    {
      "recommendation_id": "REC-B4D8B7D61D3E",
      "dimension_type": "priority",
      "target": "Média",
      "severity": "HIGH",
      "title": "Investigar dimensão com risco elevado",
      "recommendation": "Revisar causas recorrentes, capacidade operacional e ações preventivas para reduzir o risco.",
      "evidence": "Posição 1 no ranking de priority, com score de risco 52.19.",
      "metric_name": "risk_score",
      "metric_value": 52.19,
      "metric_unit": "score"
    },
    {
      "recommendation_id": "REC-D557C3B8CB12",
      "dimension_type": "assigned_group",
      "target": "Team05",
      "severity": "HIGH",
      "title": "Reduzir violações de KPI",
      "recommendation": "Analisar os incidentes violados, identificar causas comuns e definir um plano de correção.",
      "evidence": "Taxa calculada de violação de 27.39% em 3739 incidentes avaliados.",
      "metric_name": "kpi_violation_rate_pct",
      "metric_value": 27.39,
      "metric_unit": "percent"
    },
    {
      "recommendation_id": "REC-E74084EED7C8",
      "dimension_type": "assigned_group",
      "target": "Team16",
      "severity": "HIGH",
      "title": "Reduzir violações de KPI",
      "recommendation": "Analisar os incidentes violados, identificar causas comuns e definir um plano de correção.",
      "evidence": "Taxa calculada de violação de 42.11% em 152 incidentes avaliados.",
      "metric_name": "kpi_violation_rate_pct",
      "metric_value": 42.11,
      "metric_unit": "percent"
    },
    {
      "recommendation_id": "REC-F459776F9B0C",
      "dimension_type": "category",
      "target": "cat59",
      "severity": "HIGH",
      "title": "Investigar dimensão com risco elevado",
      "recommendation": "Revisar causas recorrentes, capacidade operacional e ações preventivas para reduzir o risco.",
      "evidence": "Posição 1 no ranking de category, com score de risco 55.07.",
      "metric_name": "risk_score",
      "metric_value": 55.07,
      "metric_unit": "score"
    },
    {
      "recommendation_id": "REC-0F67604AB9C0",
      "dimension_type": "assigned_group",
      "target": "Team14",
      "severity": "MEDIUM",
      "title": "Avaliar concentração de volume",
      "recommendation": "Revisar capacidade, distribuição da demanda e oportunidades de automação preventiva.",
      "evidence": "Maior volume da dimensão, com 92775 incidentes.",
      "metric_name": "volume",
      "metric_value": 92775.0,
      "metric_unit": "incidents"
    },
    {
      "recommendation_id": "REC-A5773C37E462",
      "dimension_type": "category",
      "target": "cat71",
      "severity": "MEDIUM",
      "title": "Avaliar concentração de volume",
      "recommendation": "Revisar capacidade, distribuição da demanda e oportunidades de automação preventiva.",
      "evidence": "Maior volume da dimensão, com 7335 incidentes.",
      "metric_name": "volume",
      "metric_value": 7335.0,
      "metric_unit": "incidents"
    },
    {
      "recommendation_id": "REC-CC50A8B256AA",
      "dimension_type": "product",
      "target": "lhco",
      "severity": "MEDIUM",
      "title": "Avaliar concentração de volume",
      "recommendation": "Revisar capacidade, distribuição da demanda e oportunidades de automação preventiva.",
      "evidence": "Maior volume da dimensão, com 12835 incidentes.",
      "metric_name": "volume",
      "metric_value": 12835.0,
      "metric_unit": "incidents"
    }
  ]
}